text,text_length,indicator_id,indicator_name,category,subcategory,framework,match_score,keyword_matches,matched_keywords,label,report_name
"Mit Solaranlagen, E-Mobilität, Energiespeichern, einer sinnvollen Energiesteuerung und Lösungen für die Sektorkopplung senken unsere Kundinnen und Kunden einerseits ihre Kosten und Emissionen  und steigern anderseits Komfort und Lebensqualität. Das gilt gleichermaßen für Privatkunden und kleine Unternehmen wie auch für große Betriebe und Kommunen. Europas Energiesystem wird immer CO2-freier, dezentraler und digitaler.",421,ONT_043,Environmental_Mgmt._System,Environmental,Environmental_Mgmt._System,ONTOLOGY,0.14285714285714285,1,system,1,EON_GB2023_gesamt_dt_final.pdf
Über E.ON Inhalt Suchen Zurück 4 E.ON Integrierter Geschäftsbericht 2023 E.ON auf einen Blick 5 An unsere Investoren 14 Zusammengefasster Lagebericht 26 Grundlagen des Konzerns 29 Klimaschutz und Umwelt 42 Mitarbeiter und Gesellschaft 58 Governance 80 Nachhaltige Finanzierung und nachhaltiges Investment 93 Wirtschaftsbericht 103 Prognosebericht 128 Risiko- und Chancenbericht 130 Angaben nach  289 Abs. 4 beziehungsweise 315 Abs.,431,ONT_038,Corporate_Governance,Environmental,Corporate_Governance,ONTOLOGY,0.2,1,governance,1,EON_GB2023_gesamt_dt_final.pdf
"4 HGB zum internen Kontrollsystem im Hinblick auf den Rechnungslegungsprozess 139 Übernahmerelevante Angaben  Angaben nach  289a,  315a HGB sowie erläuternder Bericht 142 Konzernabschluss 144 Gewinn- und Verlustrechnung 145 Aufstellung der im Eigenkapital erfassten Erträge und Aufwendungen 146 Bilanz 147 Kapitalflussrechnung 149 Entwicklung des Eigenkapitals 151 Anhang 153 Weitere Informationen 265 Versicherung der gesetzlichen Vertreter 266 Bestätigungsvermerk des unabhängigen Abschlussprüfers 267 Prüfungsvermerk des unabhängigen Wirtschaftsprüfers 274 Organe 277 Mehrjahresübersicht 281 Task Force on Climate-related Financial Disclosures (TCFD) 283 Nachhaltigkeitskennzahlen 285 EU-Taxonomie 290 Global Reporting Initiative (GRI)-Index 303 Index zur nichtfinanziellen Erklärung (NFE) 309 Sustainable Development Goals (SDG)-Index 310 Sustainability Accounting Standards Board (SASB)-Index 311 Finanzkalender und Impressum 317 Inhalt Suchen Zurück 5 E.ON Integrierter Geschäftsbericht 2023 Tempo bei Investitionen beschleunigt und insgesamt 6,4 Mrd  im Jahr 2023 investiert Wachstumskurs im Jahr 2023 erfolgreich fortgesetzt und Prognose unter anderem aufgrund temporärer Effekte übertroffen: bereinigtes EBITDA von 9,4 Mrd  und bereinigten Konzernüberschuss von 3,1 Mrd  erzielt Ausblick für das Geschäftsjahr 2024: bereinigtes EBITDA zwischen 8,8 und 9,0 Mrd  und bereinigter Konzernüberschuss zwischen 2,8 und 3,0 Mrd  erwartet Dividende in Höhe von 0,53  pro Aktie für das Geschäftsjahr 2023 vorgeschlagen  dies entspricht einer Steigerung von 4 Prozent gegenüber dem Vorjahr Verschuldungsfaktor liegt Ende 2023 mit 4,0 deutlich unterhalb des Maximalwerts von 5,0 E.ON auf einen Blick Inhalt Suchen Zurück 6 E.ON Integrierter Geschäftsbericht 2023 Wie wir Wert schaffen Die folgende Übersicht zeigt anhand von Beispielen und relevanten Daten, wie wir Wert für unsere Stakeholder schaffen.",1900,ONT_018,Employee_Development,Environmental,Employee_Development,ONTOLOGY,0.2,1,development,1,EON_GB2023_gesamt_dt_final.pdf
")2 37.691 32.742 15 Verschuldungsfaktor2 4,0 4,1 -2 Kreditrating SP BBB BBB 0 Kreditrating Moodys Baa2 Baa2 0 Kreditrating Fitch BBB BBB 0 Durchschnittliches Capital Employed 59.895 58.760 2 Eigenkapital 19.970 21.867 -9 Bilanzsumme 113.506 134.009 -15 Cash Conversion Rate (in ) 80 151 -473 ROCE (in ) 10,7 8,8 223 Ergebnis je Aktie4, 5 (in ) 0,20 0,70 -71 Ergebnis je Aktie aus bereinigtem Konzernüberschuss4, 5 (in ) 1,18 1,05 12 Dividende je Aktie6 (in ) 0,53 0,51 4 Dividendensumme 1.384 1.331 4 Inhalt Suchen Zurück 10 E.ON Integrierter Geschäftsbericht 2023 Kennzahlen Nachhaltigkeit Inhalt Suchen Zurück 11 E.ON Integrierter Geschäftsbericht 2023 Kennzahlen des E.ON-Konzerns Nachhaltigkeit Nachhaltigkeitskennzahlen 2023 2022 Umwelt CO2-Emissionen: Scope 1 (in Mio Tonnen) 2,01 2,88 Scope 2 (in Mio Tonnen) (standortbasiert) 3,46 3,38 Scope 3 (in Mio Tonnen) (marktbasiert) 65,23 82,58 Investitionen (CapEx) gemäß EU-Taxonomie-Verordnung (in )1 98 98 Betriebsausgaben (OpEx) gemäß EU-Taxonomie-Verordnung (in )1 98 97 Umsatz gemäß EU-Taxonomie-Verordnung (in )1 97 97 Vermiedene CO2-Emissionen zusammen mit unseren Kunden (in Mio Tonnen)2 106 108 Anteil der Anschlussleistung der Erneuerbare-Energie-Anlagen am Stromnetz von E.ON (in )3 86 85 Ökologisches Trassenmanagement (in ) 12 8 Anzahl der installierten Smart Energy Meter (in Tsd) 13.803 12.178 Anzahl der installierten Wärmezähler (in Tsd) 94 n.a.",1414,ONT_003,Energy,Environmental,Energy,ONTOLOGY,0.3333333333333333,1,energy,1,EON_GB2023_gesamt_dt_final.pdf
"pro Mitarbeiter)7 22,0 18,2 Durchschnittliche Dauer der Netzausfälle für Strom (SAIDI) (in Minuten)8 Deutschland 21 24 Schweden 156 121 Tschechien 253 451 Gemeinschaftsbeitrag (in Mio ) 22 18 Ehrenamtliches Engagement von E.ON-Mitarbeitern (Anzahl Stunden ehrenamtlicher Arbeit) 22.129 13.340 Unternehmensführung Anteil von Frauen im Aufsichtsrat (in )9 38 30 Anteil unabhängiger Aufsichtsratsmitglieder (in ) 100 100 ESG-Ziele sind Bestandteil der Vorstandsvergütung   1 Anteil taxonomiekonformer Investitionen, Betriebsausgaben und Umsatzerlöse in Bezug auf taxonomiefähige Aktivitäten  2 Die Kennzahl quantifiziert die vermiedenen Emissionen, die im Zusammenhang mit unseren Kunden, Anlagen und Lösungen zu einer kohlenstoffarmen Wirtschaft beitragen  3 Der Anteil der angeschlossenen Erneuerbare-Energien-Kapazität ist der berechnete Prozentsatz der Summe der installierten Erneuerbare-Energien-Leistung geteilt durch die Gesamtsumme aller installierten Erzeugungskapazitäten  4 Anzahl der Mitarbeiter in Personen ohne Auszubildende und WerkstudentenPraktikanten  5 Serious Incidents and Fatalities (SIF) bei Mitarbeitern: Sicherheitsvorfälle pro Mio Arbeitsstunden  6 Lost Time Injury Frequency (LTIF) misst arbeitsbedingte Unfälle mit Ausfallzeiten pro Mio Arbeitsstunden  7 Durchschnittliche formale Schulungsstunden pro Mitarbeiter und Jahr  8 System Average Interruption Duration Index (SAIDI) für Strom  9 Bezieht sich auf Aktionärsvertreter Inhalt Suchen Zurück 12 E.ON Integrierter Geschäftsbericht 2023 Kennzahlen Energienetze Inhalt Suchen Zurück 13 E.ON Integrierter Geschäftsbericht 2023 Kennzahlen Kundenlösungen Inhalt Suchen Zurück 14 E.ON Integrierter Geschäftsbericht 2023 Gute Gründe, in die E.ON-Aktie zu investieren Energienetze Langfristiges grünes Wachstum in einem regulierten Umfeld Jahrzehntelange Wachstumschancen durch die grüne Energiewende und ein reguliertes Geschäftsmodell sorgen für eine erkennbare und profitable Ergebnisentwicklung Energy Infrastructure Solutions (EIS) Beschleunigtes Wachstum durch Infrastrukturprojekte Das erstklassige Infrastrukturportfolio profitiert von der notwendigen Dekarbonisierung von Städten und Industrien Energy Retail Attraktive Renditen und zuverlässige Cashflows Stabile Cashflows aus einem diversifizierten und investitionsarmen Geschäft.",2313,ONT_003,Energy,Environmental,Energy,ONTOLOGY,0.3333333333333333,1,energy,1,EON_GB2023_gesamt_dt_final.pdf
"E.ON hat bereits im Jahr 2021 den Rahmen des sogenannten Green Bond Framework für Wertpapierschuldverschreibungen, deren Emissionserlöse zur Finanzierung nachhaltiger Investitionsprojekte dienen  als damals erstes Unternehmen , vollständig nicht nur auf die ICMA Green Bond Principles, sondern auch auf die EU-Taxonomie abgestellt.",331,ONT_015,GHG_Emissions,Environmental,GHG_Emissions,ONTOLOGY,0.25,1,emissions,1,EON_GB2023_gesamt_dt_final.pdf
"Von links nach rechts: Marc Spieker Chief Financial Officer Victoria Ossadnik Chief Operating Officer Digital Thomas König Chief Operating Officer Networks Patrick Lammers Chief Operating Officer Commercial Leonhard Birnbaum Chief Executive Officer An unsere Investoren Inhalt Suchen Zurück  E.ON am Kapitalmarkt  Brief des Vorstandsvorsitzenden  Bericht des Aufsichtsrats 19 E.ON Integrierter Geschäftsbericht 2023 Brief des Vorstands- vorsitzenden Liebe Aktionärinnen und Aktionäre, liebe Freundinnen und Freunde von E.ON, als ich vor drei Jahren mein Amt übernahm, habe ich von einer Dekade des Wachstums für E.ON gesprochen.",628,ONT_045,Financial_Inclusion,Environmental,Financial_Inclusion,ONTOLOGY,0.2,1,financial,1,EON_GB2023_gesamt_dt_final.pdf
"Mit unseren Milliardeninvestitionen in die Energiewende bieten wir das, was Europa jetzt mehr denn je braucht: eine neue Energieinfrastruktur für nachhaltige, sichere und bezahlbare Energie. Der Zubau der erneuerbaren Erzeugung findet weltweit und überall statt. In Frankreich trotz der Kernkraft. In Polen trotz der Steinkohle. In Asien trotz des gleichzeitigen Zubaus an konventioneller Erzeugung. In den Südstaaten der USA trotz der Tatsache, dass Climate Action dort fast ein Schimpfwort ist.",496,ONT_034,Climate_Risk_Mgmt.,Environmental,Climate_Risk_Mgmt.,ONTOLOGY,0.14285714285714285,1,climate,1,EON_GB2023_gesamt_dt_final.pdf
Es geht um eine Elektrifizierung des Verkehrs und der Heiz- und Klimatechnik von Gebäuden. Und für all das braucht es Netzanschlüsse und einen weltweiten Ausbau beziehungsweise eine Ertüchtigung bestehender Netze. Die IEA rechnet in ihrem jüngsten World Energy Outlook mit einer erforderlichen Verdopplung der globalen Netzinfrastruktur.,337,ONT_003,Energy,Environmental,Energy,ONTOLOGY,0.3333333333333333,1,energy,1,EON_GB2023_gesamt_dt_final.pdf
"Es ist ein Wachstumsgeschäft, das immer stärker in den Fokus von Politik, Öffentlichkeit und Kapitalanlegern rückt. Denn unsere Netze sind systemrelevant für die Energiewende. Die letzten Wochen im Kalenderjahr 2023 markierten in dieser Hinsicht fast schon so etwas wie eine Zäsur: Zum einen hat die Europäische Kommission ihren Grid Action Plan verabschiedet. Damit hat sie  noch vor wenigen Jahren undenkbar  den Netzausbau an die Spitze ihrer Energiewende-Agenda gesetzt.",474,ONT_043,Environmental_Mgmt._System,Environmental,Environmental_Mgmt._System,ONTOLOGY,0.14285714285714285,1,system,1,EON_GB2023_gesamt_dt_final.pdf
"Die Transformation des europäischen Energiesystems hat in Folge des russischen Angriffskriegs auf die Ukraine weiter Fahrt aufgenommen. E.ON kam dabei eine Schlüsselrolle zu. In einem weiterhin volatilen Marktumfeld galt es, die Umsetzung der Wachstumsstrategie, verbunden mit erheblichen Investitionen in den Netzausbau und Dekarbonisierungslösungen, zu bekräftigen. In den nächsten Jahren wird die Energiewirtschaft der Ort des Wachstums sein.",445,ONT_043,Environmental_Mgmt._System,Environmental,Environmental_Mgmt._System,ONTOLOGY,0.14285714285714285,1,system,1,EON_GB2023_gesamt_dt_final.pdf
"Weiterhin hat er im Einvernehmen mit Patrick Lammers entschieden, dessen Bestellung nicht zu verlängern. Corporate Governance In der zum Jahresende abgegebenen Entsprechenserklärung hat der Aufsichtsrat  gemeinsam mit dem Vorstand  erklärt, dass den vom Bundesministerium der Justiz am 27. Juni 2022 im amtlichen Teil des Bundesanzeigers bekannt gemachten Empfehlungen der Regierungskommission Deutscher Corporate Governance Kodex (Fassung vom 28.",447,ONT_038,Corporate_Governance,Environmental,Corporate_Governance,ONTOLOGY,0.4,2,"governance, corporate",1,EON_GB2023_gesamt_dt_final.pdf
"April 2022) seit Abgabe der letzten Erklärung im Dezember 2022 uneingeschränkt entsprochen wurde. Vorstand und Aufsichtsrat haben weiter erklärt, dass den vom Bundesministerium der Justiz am 27. Juni 2022 im amtlichen Teil des Bundesanzeigers bekannt gemachten Empfehlungen der Regierungskommission Deutscher Corporate Governance Kodex (Fassung vom 28. April 2022) uneingeschränkt entsprochen wird.",398,ONT_038,Corporate_Governance,Environmental,Corporate_Governance,ONTOLOGY,0.4,2,"governance, corporate",1,EON_GB2023_gesamt_dt_final.pdf
"Die jeweils aktuelle Entsprechenserklärung sowie frühere Fassungen sind im Internet unter www.eon.com veröffentlicht worden. Zu Beginn des Jahres 2023 hat der Aufsichtsratsvorsitzende im Rahmen einer Corporate Governance Roadshow mit Investoren über aufsichtsratsspezifische Themen Gespräche geführt. Gemäß der Satzung der E.ON SE ist der Vorstand ermächtigt, vorzusehen, dass Hauptversammlungen, die bis zum 30.",412,ONT_038,Corporate_Governance,Environmental,Corporate_Governance,ONTOLOGY,0.4,2,"governance, corporate",1,EON_GB2023_gesamt_dt_final.pdf
Im Rahmen einer im Vereinigten Königreich durchgeführten Sitzung wurde das britische Kundenlösungsgeschäft umfassend präsentiert und die Dekarbonisierung der Energie- und Wärmeversorgung anschaulich erläutert. Die Ziele für die Zusammensetzung des Aufsichtsrats inklusive eines Kompetenzprofils und eines Diversitätskonzepts gemäß der Empfehlung C.1 des Deutschen Corporate Governance Kodex und  289f Abs.,405,ONT_038,Corporate_Governance,Environmental,Corporate_Governance,ONTOLOGY,0.4,2,"governance, corporate",1,EON_GB2023_gesamt_dt_final.pdf
Der Ausschuss hat in seinen Sitzungen insbesondere die aktuellen Entwicklungen im Zusammenhang mit der Transformation des europäischen Energiesystems und die damit einhergehenden politischen und regulatorischen Veränderungen behandelt. Zudem hat sich der Präsidialausschuss mit der Vorstandsvergütung einschließlich der Erreichung der Vorstandsziele für das Jahr 2023 und der Festlegung der Ziele für das Jahr 2024 befasst.,423,ONT_043,Environmental_Mgmt._System,Environmental,Environmental_Mgmt._System,ONTOLOGY,0.14285714285714285,1,system,1,EON_GB2023_gesamt_dt_final.pdf
Der Prüfungs- und Risikoausschuss hielt im Geschäftsjahr 2023 vier Sitzungen ab. Ein Mitglied war bei einer der Sitzungen verhindert. Im Übrigen nahmen sämtliche Mitglieder an allen Sitzungen teil. Der Ausschuss befasste sich im Rahmen einer eingehenden Prüfung insbesondere mit dem handelsrechtlichen Jahresabschluss und dem Konzernabschluss für das Geschäftsjahr 2022 nach den International Financial Reporting Standards (IFRS) sowie den Zwischenabschlüssen der E.ON SE im Jahr 2023.,485,ONT_045,Financial_Inclusion,Environmental,Financial_Inclusion,ONTOLOGY,0.2,1,financial,1,EON_GB2023_gesamt_dt_final.pdf
"Der Ausschuss erörterte den Vorschlag zur Wahl des Abschlussprüfers für das Geschäftsjahr 2023 sowie die entsprechenden Zwischenabschlüsse und erteilte die Aufträge für die Prüfungsleistungen des Abschlussprüfers, legte die Prüfungsschwerpunkte fest, beschloss die Vergütung des Abschlussprüfers und überprüfte dessen Qualifikation sowie die Qualität der Abschlussprüfung und die Unabhängigkeit gemäß den Anforderungen des Gesetzes und des Deutschen Corporate Governance Kodex.",477,ONT_038,Corporate_Governance,Environmental,Corporate_Governance,ONTOLOGY,0.4,2,"governance, corporate",1,EON_GB2023_gesamt_dt_final.pdf
"Bei den Wahlvorschlägen an den Aufsichtsrat hat der Nominierungsausschuss neben den Anforderungen des Aktiengesetzes, des Deutschen Corporate Governance Kodex und der Geschäftsordnung des Aufsichtsrats auch die vom Aufsichtsrat für seine Zusammensetzung beschlossenen Ziele berücksichtigt.",289,ONT_038,Corporate_Governance,Environmental,Corporate_Governance,ONTOLOGY,0.4,2,"governance, corporate",1,EON_GB2023_gesamt_dt_final.pdf
"März 2024 Der Aufsichtsrat Mit freundlichen Grüßen Erich Clementi Vorsitzender Inhalt Suchen Zurück 26 E.ON Integrierter Geschäftsbericht 2023 Grundlagen des Konzerns 29 Geschäftsmodell 29 ESG-Wesentlichkeit und Stakeholder Engagement 29 Strategie 33 Innovation 38 Steuerungssystem 40 Klimaschutz und Umwelt 42 Klimaschutz 42 Umweltmanagement 49 Nachhaltige Produkte und Services 54 Mitarbeiter und Gesellschaft 58 Gesundheit und Arbeitssicherheit 58 Arbeitsbedingungen und Mitarbeiterentwicklung 63 Kundenzufriedenheit 68 Versorgungssicherheit 70 Gesellschaftliches Engagement 74 Datenschutz, Cybersicherheit und Produktsicherheit 75 Business Resilience Management 78 Governance 80 Compliance und Antikorruption 80 Bezahlbare Energie 83 Diversity und Inklusion 84 Menschenrechte und Lieferantenmanagement 87 Steuern 91 Nachhaltige Finanzierung und nachhaltiges Investment 93 EU-Taxonomie 93 Nachhaltige Finanzierung 101 ESG-Ratings von E.ON 102 ESG-Asset-Management und Pensionsvermögen 102 Wirtschaftsbericht 103 Gesamtwirtschaftliche und branchenbezogene Rahmenbedingungen 103 Besondere Ereignisse im Berichtszeitraum 108 Besondere Ereignisse nach dem Bilanzstichtag 110 Geschäftsentwicklung 111 Energienetze 112 Kundenlösungen 113 Ertragslage 115 Finanzlage 121 Vermögenslage 125 Ertrags-, Finanz- und Vermögenslage der E.ON SE 126 Prognosebericht 128 Risiko- und Chancenbericht 130 Angaben nach  289 Abs.",1409,ONT_041,Diversity,Environmental,Diversity,ONTOLOGY,0.3333333333333333,1,diversity,1,EON_GB2023_gesamt_dt_final.pdf
"4 beziehungsweise 315 Abs. 4 HGB zum internen Kontrollsystem im Hinblick auf den Rechnungslegungsprozess 139 Übernahmerelevante Angaben  Angaben nach  289a,  315a HGB sowie erläuternder Bericht 142 Zusammengefasster Lagebericht Zusammengefasster Lagebericht Inhalt Suchen Zurück Über diesen Bericht Klimaschutz und Umwelt Mitarbeiter und Gesellschaft Governance Nachhaltige Finanzierung Prognosebericht Risiko- und Chancenbericht Internes Kontrollsystem Übernahmerelevante Angaben Grundlagen des Konzerns Wirtschaftsbericht 27 E.ON Integrierter Geschäftsbericht 2023 Über diesen Bericht GRI 2-2, GRI 2-3, GRI 2-4, GRI 2-5, GRI 2-6 Für das Berichtsjahr 2023 veröffentlicht E.ON erneut einen integrierten Geschäftsbericht, der Finanz- und Nachhaltigkeitsberichterstattung kombiniert, denn: Nachhaltigkeit ist Kern unserer Strategie und  in jeder Dimension  der Maßstab für unser Handeln.",885,ONT_038,Corporate_Governance,Environmental,Corporate_Governance,ONTOLOGY,0.2,1,governance,1,EON_GB2023_gesamt_dt_final.pdf
"Durch die Integration der Berichterstattung geben wir unseren verschiedenen Stakeholderinnen und Stakeholdern einen ganzheitlichen und transparenten Einblick in unsere finanzielle, ökologische und soziale Performance. Standards Der vorliegende integrierte Geschäftsbericht gilt sowohl für den E.ON-Konzern als auch für die E.ON SE.",331,,GHGEmissionsScope1,Environmental,Climate Change,,0.125,1,stakeholder,1,EON_GB2023_gesamt_dt_final.pdf
"Damit erfüllt E.ON alle Anforderungen der International Financial Reporting Standards (IFRS), des deutschen Handelsgesetzbuches (HGB) und der Deutschen Rechnungslegungsstandards (DRS). Die zusammengefasste nichtfinanzielle Konzernerklärung (NFE) gemäß  315b, 315c in Verbindung mit  289b bis 289e HGB ist vollumfänglich in den zusammengefassten Lagebericht integriert.",368,ONT_045,Financial_Inclusion,Environmental,Financial_Inclusion,ONTOLOGY,0.2,1,financial,1,EON_GB2023_gesamt_dt_final.pdf
"Die Nachhaltigkeitsberichterstattung, die aus der NFE und darüber hinausgehenden Nachhaltigkeitsangaben besteht, orientiert sich an den Ergebnissen der Wesentlichkeitsanalyse sowie Stakeholder-relevanten Themen. Sie wurde unter Bezugnahme auf die GRI-Standards 2021 der Global Reporting Initiative (GRI) erstellt. Am Anfang eines Kapitels sind diejenigen GRI-Standards ausgewiesen, die durch die Inhalte abgedeckt werden. Eine Übersicht ist im GRI-Index zu finden.",464,,GHGEmissionsScope1,Environmental,Climate Change,,0.125,1,stakeholder,1,EON_GB2023_gesamt_dt_final.pdf
Unter Weitere Informationen finden sich außerdem E.ONs Angaben zu den vom Sustainability Accounting Standards Board (SASB) herausgegebenen Electric Utilities and Power Generators Standards. E.ON bekennt sich zu den zehn Prinzipien des Global Compact der Vereinten Nationen (UNGC) und unterstützt die Ziele für nachhaltige Entwicklung der Vereinten Nationen (UN Sustainable Development Goals  SDGs). Unsere Beiträge zu den SDGs legen wir im Kapitel Strategie dar.,462,ONT_018,Employee_Development,Environmental,Employee_Development,ONTOLOGY,0.2,1,development,1,EON_GB2023_gesamt_dt_final.pdf
"Unsere klimabezogene Berichterstattung, die sich außerdem an den Empfehlungen der Task Force on Climate-related Financial Disclosures (TCFD) orientiert, ist im Kapitel Klimaschutz zu finden. Umfang Gegenstand des Berichts sind alle im Konzernabschluss 2023 voll konsolidierten Tochterunternehmen von E.ON. Abweichungen sind entsprechend gekennzeichnet. Zur Abgrenzung von nicht wesentlich zum Bericht beitragenden Gesellschaften werden kennzahlenbasierte Schwellenwerte herangezogen.",483,ONT_045,Financial_Inclusion,Environmental,Financial_Inclusion,ONTOLOGY,0.2,1,financial,1,EON_GB2023_gesamt_dt_final.pdf
"Aussagen über die zukünftige Entwicklung von E.ON und ihren Tochterunternehmen stellen Einschätzungen dar, die auf Basis von zum Zeitpunkt der Berichterstattung zur Verfügung stehenden Informationen getroffen wurden. Die tatsächlichen Ergebnisse können von diesen Aussagen abweichen. Die Erklärung zur Unternehmensführung ist auf unserer Website eon.com im Bereich Corporate Governance zu finden. Der integrierte Geschäftsbericht wurde am 13.",442,ONT_038,Corporate_Governance,Environmental,Corporate_Governance,ONTOLOGY,0.4,2,"governance, corporate",1,EON_GB2023_gesamt_dt_final.pdf
Zusammengefasster Lagebericht Inhalt Suchen Zurück Über diesen Bericht Klimaschutz und Umwelt Mitarbeiter und Gesellschaft Governance Nachhaltige Finanzierung Prognosebericht Risiko- und Chancenbericht Internes Kontrollsystem Übernahmerelevante Angaben Grundlagen des Konzerns Wirtschaftsbericht 28 E.ON Integrierter Geschäftsbericht 2023 Prüfung Der zusammengefasste Lagebericht wird grundsätzlich im Rahmen der gesetzlich vorgeschriebenen Abschlussprüfung geprüft.,466,ONT_038,Corporate_Governance,Environmental,Corporate_Governance,ONTOLOGY,0.2,1,governance,1,EON_GB2023_gesamt_dt_final.pdf
Für die nichtfinanzielle Erklärung und ausgewählte weiterführende Nachhaltigkeitsinformationen erfolgte darüber hinaus eine gesonderte betriebswirtschaftliche Prüfung (Nachhaltigkeitsprüfung) durch die KPMG AG in Übereinstimmung mit dem International Standard on Assurance Engagements (ISAE) 3000 (Revised) des International Auditing and Assurance Standards Board (IAASB). Die für die unterschiedlichen Inhalte angewendete Prüfungssicherheit wird im Bericht über verschiedene Symbole verdeutlicht.,497,ONT_020,Board_Diversity,Environmental,Board_Diversity,ONTOLOGY,0.2,1,board,1,EON_GB2023_gesamt_dt_final.pdf
"Zusammengefasster Lagebericht Inhalt Suchen Zurück  Über diesen Bericht  Grundlagen des Konzerns  Klimaschutz und Umwelt  Mitarbeiter und Gesellschaft  Governance  Nachhaltige Finanzierung  Wirtschaftsbericht  Prognosebericht  Risiko- und Chancenbericht  Internes Kontrollsystem  Übernahmerelevante Angaben 29 E.ON Integrierter Geschäftsbericht 2023 Grundlagen des Konzerns Geschäftsmodell E.ON ist ein privates Energieunternehmen mit rund 74.600 Mitarbeiterinnen und Mitarbeitern, das von der Konzernleitung in Essen geführt wird.",531,ONT_038,Corporate_Governance,Environmental,Corporate_Governance,ONTOLOGY,0.2,1,governance,1,EON_GB2023_gesamt_dt_final.pdf
"Aufgaben, die in diesem Zusammenhang unter anderem wahrgenommen werden, sind die länder- und marktübergreifende Optimierung des Gesamtgeschäfts unter finanziellen, strategischen und Risikogesichtspunkten, das Stakeholdermanagement sowie die Steuerung der zentralen Commodity-Beschaffungseinheit E.ON Energy Markets GmbH (E.ON Energy Markets). Zudem werden die nichtstrategischen Aktivitäten des E.ON-Konzerns, wie der Betrieb der Kernkraftwerke bis zum 15.",456,ONT_003,Energy,Environmental,Energy,ONTOLOGY,0.3333333333333333,1,energy,1,EON_GB2023_gesamt_dt_final.pdf
"Dabei ist der E.ON-Konzern insbesondere in den Märkten Deutschland, Großbritannien, Niederlande, Nordics (zum Beispiel Schweden, Dänemark und Norwegen), Italien, Tschechien, Ungarn, Kroatien, Rumänien, Polen und Slowakei vertreten. Darüber hinaus umfasst das Energy Infrastructure Solutions-Geschäft die Aktivitäten zur Dekarbonisierung von Geschäftskunden, Städten und Gemeinden, wie zum Beispiel Projekte für Quartierslösungen und Fernwärme. Wesentliche Änderungen des Geschäftsmodells ab dem 1.",497,ONT_003,Energy,Environmental,Energy,ONTOLOGY,0.3333333333333333,1,energy,1,EON_GB2023_gesamt_dt_final.pdf
"Ab diesem Zeitpunkt wird das Energy Infrastructure Solutions-Geschäft (EIS) ein eigenständiges Geschäftsfeld durch Ausgliederung aus dem Geschäftsfeld Kundenlösungen. Damit die Bezeichnung des Geschäftsfeldes Kundenlösungen dessen Aktivitäten widerspiegelt, wird dieses in Energy Retail umbenannt. Des Weiteren wird die zentrale Commodity-Beschaffungseinheit des E.ON-Konzerns, E.ON Energy Markets, seit dem 1. Januar 2024 im Geschäftsfeld Energy Retail ausgewiesen.",466,ONT_003,Energy,Environmental,Energy,ONTOLOGY,0.3333333333333333,1,energy,1,EON_GB2023_gesamt_dt_final.pdf
"Dezember 2023 war sie in KonzernleitungSonstiges enthalten. ESG-Wesentlichkeit und Stakeholder Engagement  ESG-Wesentlichkeit GRI 3-1, GRI 3-2 Seit 2006 führt E.ON jährlich eine Wesentlichkeitsanalyse durch. Mit ihr ermittelt und bewertet das Unternehmen die für es und seine Stakeholder wichtigsten Nachhaltigkeitsthemen. Der vorliegende Bericht enthält Informationen zu den Themen, die im Rahmen der Analyse als besonders bedeutend eingestuft wurden.",452,,GHGEmissionsScope1,Environmental,Climate Change,,0.125,1,stakeholder,1,EON_GB2023_gesamt_dt_final.pdf
